[
  {
    "id": "observability-96dde0d33b",
    "q_number": 1,
    "question": "A Prometheus metric is incremented by 1 each time an HTTP request completes. After a service restart, you notice the metric resets to 0. Which metric type best describes this behavior and why is it appropriate here?",
    "choices": [
      "Gauge, because gauges track cumulative totals that reset on restart",
      "Counter, because counters represent monotonically increasing values that reset only on process restart",
      "Histogram, because histograms bucket request counts across latency ranges",
      "Summary, because summaries compute request-rate percentiles server-side"
    ],
    "correct": "Counter, because counters represent monotonically increasing values that reset only on process restart",
    "explanation": "A counter is a cumulative metric that only goes up (or resets to zero on process restart). Resetting on restart is expected and handled by PromQL's rate() and increase() functions, which detect resets automatically. A gauge can go up or down, making it inappropriate for a value that only increments. A histogram and summary are both suited to latency/size distributions, not simple event counts. Source: Prometheus documentation — Metric types (https://prometheus.io/docs/concepts/metric_types/).",
    "category": "devops",
    "subcategory": "observability",
    "topic": "Prometheus metric types, data model, and PromQL fundamentals",
    "topic_label": "Metrics & Dashboards",
    "total_topic_questions": 10,
    "type": "multiple",
    "image": "",
    "tags": [
      "observability",
      "monitoring"
    ]
  },
  {
    "id": "observability-a38233d4b3",
    "q_number": 2,
    "question": "Your team uses a Prometheus gauge to track the number of active database connections. During an incident, the gauge shows 0 connections even though the database is clearly receiving traffic. What is the most likely cause?",
    "choices": [
      "Gauges are monotonically increasing and cannot decrease below their last value",
      "The scrape interval is longer than the spike duration, causing Prometheus to miss the peak",
      "Gauges reset to 0 on every scrape, so you should use a counter instead",
      "Prometheus only stores integer gauge values; floating-point connections are truncated"
    ],
    "correct": "The scrape interval is longer than the spike duration, causing Prometheus to miss the peak",
    "explanation": "A gauge is a snapshot metric — Prometheus records whatever value it sees at the moment of each scrape. If connection spikes are shorter than the scrape interval (default 15s), they are invisible in the time series. Gauges can decrease freely (unlike counters) and are not reset to 0 on scrape. Prometheus stores float64 values, so truncation is not the issue. The fix is to lower the scrape interval or instrument a counter for total connections opened and use rate() instead. Source: Prometheus documentation — Metric types (https://prometheus.io/docs/concepts/metric_types/).",
    "category": "devops",
    "subcategory": "observability",
    "topic": "Prometheus metric types, data model, and PromQL fundamentals",
    "topic_label": "Metrics & Dashboards",
    "total_topic_questions": 10,
    "type": "multiple",
    "image": "",
    "tags": [
      "observability",
      "monitoring",
      "troubleshooting"
    ]
  },
  {
    "id": "observability-7fa4b176e0",
    "q_number": 3,
    "question": "A team wants to alert when p99 HTTP request latency exceeds 500 ms. Which Prometheus metric type should they instrument and which PromQL function extracts the percentile?",
    "choices": [
      "Counter with rate(), because rate() computes per-second latency percentiles",
      "Gauge with quantile(), because gauges store raw latency values",
      "Histogram with histogram_quantile(), because histograms bucket observations and allow server-side quantile calculation",
      "Summary with histogram_quantile(), because summaries pre-compute quantiles that histogram_quantile() then aggregates"
    ],
    "correct": "Histogram with histogram_quantile(), because histograms bucket observations and allow server-side quantile calculation",
    "explanation": "A Prometheus histogram exposes _bucket, _sum, and _count time series. The PromQL function histogram_quantile(0.99, rate(http_request_duration_seconds_bucket[5m])) computes the p99 from the bucket data, allowing aggregation across instances. A counter tracks count only, not duration distribution. A gauge is a point-in-time snapshot, not a distribution. A summary pre-computes quantiles client-side, but histogram_quantile() does not operate on summary quantile series. Source: Prometheus documentation — Histograms and Summaries (https://prometheus.io/docs/practices/histograms/).",
    "category": "devops",
    "subcategory": "observability",
    "topic": "Prometheus metric types, data model, and PromQL fundamentals",
    "topic_label": "Metrics & Dashboards",
    "total_topic_questions": 10,
    "type": "multiple",
    "image": "",
    "tags": [
      "observability",
      "monitoring"
    ]
  },
  {
    "id": "observability-00e066914b",
    "q_number": 4,
    "question": "A developer adds a Prometheus label called `user_id` to an HTTP request counter so they can filter metrics by individual user. After deploying, Prometheus memory usage spikes and the system becomes unstable. What is the root cause?",
    "choices": [
      "The user_id label contains strings, which Prometheus cannot store efficiently",
      "Adding any new label forces Prometheus to re-scrape all existing targets",
      "High-cardinality labels create one unique time series per label value, exhausting memory when millions of users exist",
      "Prometheus enforces a hard limit of 10 labels per metric; exceeding this causes a crash"
    ],
    "correct": "High-cardinality labels create one unique time series per label value, exhausting memory when millions of users exist",
    "explanation": "Prometheus stores one time series per unique combination of metric name and label set. Using a label with unbounded cardinality — such as user_id — creates millions of series, each consuming memory for samples and index entries. This is called 'cardinality explosion' and is one of the most common Prometheus operational failures. Prometheus supports string labels natively. Re-scraping is not triggered by label changes. Prometheus has no hard label-count crash limit. The fix is to avoid high-cardinality label values; aggregate user-level data in the application instead. Source: Prometheus documentation — Best practices: Labels (https://prometheus.io/docs/practices/naming/#labels).",
    "category": "devops",
    "subcategory": "observability",
    "topic": "Prometheus metric types, data model, and PromQL fundamentals",
    "topic_label": "Metrics & Dashboards",
    "total_topic_questions": 10,
    "type": "multiple",
    "image": "",
    "tags": [
      "observability",
      "monitoring",
      "reliability"
    ]
  },
  {
    "id": "observability-ea4188cc34",
    "q_number": 5,
    "question": "In Prometheus, the scrape interval is set to 15s and the evaluation interval is set to 1m. A spike in CPU usage lasts 20 seconds. Which of the following outcomes is most likely?",
    "choices": [
      "The spike will definitely appear in the time series because 20s > 15s scrape interval",
      "The alerting rule may never fire because the 1m evaluation interval might not land during the spike",
      "Prometheus will automatically lower the scrape interval during incidents to capture spikes",
      "The evaluation interval determines when data is collected; the scrape interval controls when alerts fire"
    ],
    "correct": "The alerting rule may never fire because the 1m evaluation interval might not land during the spike",
    "explanation": "The scrape interval (15s) controls how often Prometheus collects data — so the spike will likely be captured in the time series (assuming at least one scrape falls within 20s). However, the evaluation interval (1m) controls how often alerting rules are evaluated. If the evaluation runs before and after the 20-second spike, the alert condition may never be true at evaluation time, and the alert will never fire. Prometheus does not dynamically adjust the scrape interval. The scrape interval collects data; the evaluation interval checks rules. These are separate concerns. Source: Prometheus documentation — Configuration (https://prometheus.io/docs/prometheus/latest/configuration/configuration/).",
    "category": "devops",
    "subcategory": "observability",
    "topic": "Prometheus metric types, data model, and PromQL fundamentals",
    "topic_label": "Metrics & Dashboards",
    "total_topic_questions": 10,
    "type": "multiple",
    "image": "",
    "tags": [
      "observability",
      "monitoring",
      "reliability"
    ]
  },
  {
    "id": "observability-ec80910487",
    "q_number": 6,
    "question": "A PromQL query `rate(http_requests_total[5m])` returns 'no data' for a specific service even though the service is healthy and receiving traffic. What is the most likely cause?",
    "choices": [
      "rate() requires a histogram metric; http_requests_total is a counter and incompatible",
      "The time range [5m] is shorter than twice the scrape interval, causing insufficient data points for rate calculation",
      "rate() only works on gauge metrics; use increase() for counters",
      "The metric name http_requests_total does not match Prometheus naming conventions, so it is silently dropped"
    ],
    "correct": "The time range [5m] is shorter than twice the scrape interval, causing insufficient data points for rate calculation",